{
  "version": 1,
  "generatedAt": "fingerprint:331e02f4d6acc207",
  "sourceFingerprint": "331e02f4d6acc207",
  "summary": {
    "total": 100,
    "supported": 100,
    "partial": 0,
    "unsupported": 0,
    "unknown": 0
  },
  "features": [
    {
      "id": "BM-001",
      "category": "Browse Mode",
      "subcategory": "Navigation",
      "capabilityName": "Browse/Find/Preview mode switching",
      "expectedFileMakerBehavior": "Users can switch modes reliably without losing context or causing render loops.",
      "suggestedValidationTest": "Stress test repeated mode switches while editing and filtering records.",
      "uncertainty": "low",
      "sourceStatus": "Implemented",
      "supportStatus": "supported",
      "evidence": [
        {
          "file": "src/lib/browse-url-state.ts",
          "line": 1,
          "reason": "pathHint"
        },
        {
          "file": "src/lib/browse-url-state.ts",
          "line": 1,
          "reason": "keyword"
        },
        {
          "file": "src/lib/browse-url-state.ts",
          "line": 2,
          "reason": "keyword"
        },
        {
          "file": "src/lib/browse-url-state.ts",
          "line": 4,
          "reason": "keyword"
        },
        {
          "file": "src/lib/browse-url-state.ts",
          "line": 12,
          "reason": "keyword"
        },
        {
          "file": "src/lib/browse-url-state.ts",
          "line": 29,
          "reason": "keyword"
        }
      ]
    },
    {
      "id": "BM-002",
      "category": "Browse Mode",
      "subcategory": "Navigation",
      "capabilityName": "Record navigator parity",
      "expectedFileMakerBehavior": "First/prev/next/last and record jump update current record and status area consistently.",
      "suggestedValidationTest": "Integration tests for first/prev/next/last + jump input across view modes.",
      "uncertainty": "med",
      "sourceStatus": "Implemented",
      "supportStatus": "supported",
      "evidence": [
        {
          "file": "src/lib/runtime-kernel/foundset-store.ts",
          "line": 1,
          "reason": "pathHint"
        },
        {
          "file": "src/lib/runtime-kernel/foundset-store.ts",
          "line": 97,
          "reason": "keyword"
        },
        {
          "file": "src/lib/runtime-kernel/foundset-store.ts",
          "line": 109,
          "reason": "keyword"
        },
        {
          "file": "src/lib/runtime-kernel/foundset-store.ts",
          "line": 118,
          "reason": "keyword"
        },
        {
          "file": "src/lib/runtime-kernel/foundset-store.ts",
          "line": 136,
          "reason": "keyword"
        },
        {
          "file": "src/lib/runtime-kernel/foundset-store.ts",
          "line": 146,
          "reason": "keyword"
        }
      ]
    },
    {
      "id": "BM-003",
      "category": "Browse Mode",
      "subcategory": "Find",
      "capabilityName": "Multi-request find editing and omit logic",
      "expectedFileMakerBehavior": "Find mode supports multiple requests, omit flags, and request navigation.",
      "suggestedValidationTest": "Test add/duplicate/delete request and omit behavior against deterministic dataset.",
      "uncertainty": "med",
      "sourceStatus": "Implemented",
      "supportStatus": "supported",
      "evidence": [
        {
          "file": "src/lib/find-mode.ts",
          "line": 1,
          "reason": "pathHint"
        },
        {
          "file": "src/lib/find-mode.ts",
          "line": 3,
          "reason": "keyword"
        },
        {
          "file": "src/lib/find-mode.ts",
          "line": 5,
          "reason": "keyword"
        },
        {
          "file": "src/lib/find-mode.ts",
          "line": 7,
          "reason": "keyword"
        },
        {
          "file": "src/lib/find-mode.ts",
          "line": 8,
          "reason": "keyword"
        },
        {
          "file": "src/lib/find-mode.ts",
          "line": 25,
          "reason": "keyword"
        }
      ]
    },
    {
      "id": "BM-004",
      "category": "Browse Mode",
      "subcategory": "Find",
      "capabilityName": "Constrain/Extend/Show All found set operations",
      "expectedFileMakerBehavior": "Found set commands modify active found set with clear status and deterministic behavior.",
      "suggestedValidationTest": "Integration tests for constrain and extend preserving index when possible.",
      "uncertainty": "med",
      "sourceStatus": "Implemented",
      "supportStatus": "supported",
      "evidence": [
        {
          "file": "src/lib/find-mode.ts",
          "line": 1,
          "reason": "pathHint"
        },
        {
          "file": "src/lib/find-mode.ts",
          "line": 11,
          "reason": "keyword"
        },
        {
          "file": "src/lib/find-mode.ts",
          "line": 453,
          "reason": "keyword"
        },
        {
          "file": "src/lib/find-mode.ts",
          "line": 455,
          "reason": "keyword"
        },
        {
          "file": "src/lib/find-mode.ts",
          "line": 461,
          "reason": "keyword"
        },
        {
          "file": "src/lib/find-mode.ts",
          "line": 463,
          "reason": "keyword"
        }
      ]
    },
    {
      "id": "BM-005",
      "category": "Browse Mode",
      "subcategory": "Find",
      "capabilityName": "Saved finds lifecycle",
      "expectedFileMakerBehavior": "Users can save, run, modify, duplicate, and delete saved finds.",
      "suggestedValidationTest": "Save/find/re-run/modify tests with persistence validation.",
      "uncertainty": "med",
      "sourceStatus": "Implemented",
      "supportStatus": "supported",
      "evidence": [
        {
          "file": "src/server/saved-search-storage.ts",
          "line": 1,
          "reason": "pathHint"
        },
        {
          "file": "src/server/saved-search-storage.ts",
          "line": 10,
          "reason": "keyword"
        },
        {
          "file": "src/server/saved-search-storage.ts",
          "line": 16,
          "reason": "keyword"
        },
        {
          "file": "src/server/saved-search-storage.ts",
          "line": 19,
          "reason": "keyword"
        },
        {
          "file": "src/server/saved-search-storage.ts",
          "line": 44,
          "reason": "keyword"
        },
        {
          "file": "src/server/saved-search-storage.ts",
          "line": 52,
          "reason": "keyword"
        }
      ]
    },
    {
      "id": "BM-006",
      "category": "Browse Mode",
      "subcategory": "Found Sets",
      "capabilityName": "Saved found sets lifecycle",
      "expectedFileMakerBehavior": "Users can persist found-set snapshots and reopen with graceful missing-record handling.",
      "suggestedValidationTest": "Saved found set open should skip missing ids and report reconciliation summary.",
      "uncertainty": "med",
      "sourceStatus": "Implemented",
      "supportStatus": "supported",
      "evidence": [
        {
          "file": "src/server/saved-search-storage.ts",
          "line": 1,
          "reason": "pathHint"
        },
        {
          "file": "src/server/saved-search-storage.ts",
          "line": 30,
          "reason": "keyword"
        },
        {
          "file": "src/server/saved-search-storage.ts",
          "line": 127,
          "reason": "keyword"
        },
        {
          "file": "src/server/saved-search-storage.ts",
          "line": 128,
          "reason": "keyword"
        },
        {
          "file": "src/server/saved-search-storage.ts",
          "line": 132,
          "reason": "keyword"
        },
        {
          "file": "src/server/saved-search-storage.ts",
          "line": 174,
          "reason": "keyword"
        }
      ]
    },
    {
      "id": "BM-007",
      "category": "Browse Mode",
      "subcategory": "Editing",
      "capabilityName": "Implicit save on field exit",
      "expectedFileMakerBehavior": "Leaving a field commits changes when allowed, without forcing explicit save each time.",
      "suggestedValidationTest": "Blur save test with record navigation and value persistence checks.",
      "uncertainty": "low",
      "sourceStatus": "Implemented",
      "supportStatus": "supported",
      "evidence": [
        {
          "file": "app/api/layouts/[id]/route.ts",
          "line": 71,
          "reason": "keyword"
        },
        {
          "file": "app/api/layouts/[id]/route.ts",
          "line": 72,
          "reason": "keyword"
        },
        {
          "file": "app/api/layouts/[id]/route.ts",
          "line": 77,
          "reason": "keyword"
        },
        {
          "file": "app/api/layouts/[id]/route.ts",
          "line": 79,
          "reason": "keyword"
        },
        {
          "file": "src/lib/edit-session/index.ts",
          "line": 1,
          "reason": "pathHint"
        },
        {
          "file": "src/lib/edit-session/index.ts",
          "line": 320,
          "reason": "keyword"
        }
      ]
    },
    {
      "id": "BM-008",
      "category": "Browse Mode",
      "subcategory": "Editing",
      "capabilityName": "Commit/Revert edit session semantics",
      "expectedFileMakerBehavior": "Dirty edits can be committed or reverted with prompts on navigation changes.",
      "suggestedValidationTest": "Dirty prompt tests and per-record revert behavior validations.",
      "uncertainty": "med",
      "sourceStatus": "Implemented",
      "supportStatus": "supported",
      "evidence": [
        {
          "file": "src/lib/edit-session/index.ts",
          "line": 1,
          "reason": "pathHint"
        },
        {
          "file": "src/lib/edit-session/index.ts",
          "line": 16,
          "reason": "keyword"
        },
        {
          "file": "src/lib/edit-session/index.ts",
          "line": 53,
          "reason": "keyword"
        },
        {
          "file": "src/lib/edit-session/index.ts",